{
  "schema_version": "market-impact.provider-manifest.v1",
  "provider_id": "tushare-http-planned",
  "provider_version": "0.0.0",
  "transport": "http",
  "environments": ["backtest"],
  "declared_capabilities": ["market_data"],
  "verified_capabilities": [],
  "markets": ["CN"],
  "order_types": [],
  "supports_streaming": false,
  "supports_reconciliation": false,
  "enabled": false,
  "trust_tier": "unverified"
}
